{
  "authority_id": "AUTH-US-SAMHSA-SABG-PPW-5PCT-GUIDANCE",
  "authority_type": "policy",
  "citation": "SAMHSA SABG guidance/statutory set-aside (5% PPW)",
  "administering_body": "U.S. Department of Health and Human Services (HHS) / SAMHSA",
  "governs": [
    "MF-AR-SAMHSA-DHS-ROUTING-2026"
  ],
  "effects": {
    "access_limiting": true,
    "appeal_mechanism": false
  },
  "editor_status": "pending"
}
